[
  {
    "id": "ana-distance",
    "network": "ANA",
    "objective": "distance",
    "airportIds": [
      "jp-TAK",
      "jp-OKA",
      "jp-SDJ",
      "jp-HIJ",
      "jp-CTS",
      "jp-KMQ",
      "jp-FUK",
      "jp-KIJ",
      "jp-ITM",
      "jp-HKD",
      "jp-NGO",
      "jp-MMY",
      "jp-KIX",
      "jp-ISG",
      "jp-HND",
      "jp-KOJ",
      "jp-RNJ"
    ],
    "routeIds": [
      "JP-TAK-OKA",
      "JP-OKA-SDJ",
      "JP-SDJ-HIJ",
      "JP-HIJ-CTS",
      "JP-CTS-KMQ",
      "JP-KMQ-FUK",
      "JP-FUK-KIJ",
      "JP-KIJ-ITM",
      "JP-ITM-HKD",
      "JP-HKD-NGO",
      "JP-NGO-MMY",
      "JP-MMY-KIX",
      "JP-KIX-ISG",
      "JP-ISG-HND",
      "JP-HND-KOJ",
      "JP-KOJ-RNJ"
    ],
    "totalDistanceKm": 17552.265,
    "status": "optimal",
    "scope": "bundled-reference-date-directed-network",
    "referenceDate": "2026-10-13",
    "solver": {
      "name": "SciPy/HiGHS MILP + subtour elimination",
      "version": "1.13.1",
      "gap": 4.145309801432138e-15
    },
    "constraints": {
      "repeatAirport": false,
      "fixedStart": null,
      "fixedEnd": null,
      "timetable": false
    }
  },
  {
    "id": "jal-distance",
    "network": "JAL",
    "objective": "distance",
    "airportIds": [
      "jp-IZO",
      "jp-SDJ",
      "jp-FUK",
      "jp-HNA",
      "jp-NKM",
      "jp-AOJ",
      "jp-ITM",
      "jp-ASJ",
      "jp-RNJ",
      "jp-KOJ",
      "jp-FSZ",
      "jp-OKD",
      "jp-MMJ",
      "jp-CTS",
      "jp-HIJ",
      "jp-HND",
      "jp-ISG",
      "jp-NGO",
      "jp-MMY",
      "jp-KIX",
      "jp-OKA",
      "jp-KMQ"
    ],
    "routeIds": [
      "JP-IZO-SDJ",
      "JP-SDJ-FUK",
      "JP-FUK-HNA",
      "JP-HNA-NKM",
      "JP-NKM-AOJ",
      "JP-AOJ-ITM",
      "JP-ITM-ASJ",
      "JP-ASJ-RNJ",
      "JP-RNJ-KOJ",
      "JP-KOJ-FSZ",
      "JP-FSZ-OKD",
      "JP-OKD-MMJ",
      "JP-MMJ-CTS",
      "JP-CTS-HIJ",
      "JP-HIJ-HND",
      "JP-HND-ISG",
      "JP-ISG-NGO",
      "JP-NGO-MMY",
      "JP-MMY-KIX",
      "JP-KIX-OKA",
      "JP-OKA-KMQ"
    ],
    "totalDistanceKm": 21168.655,
    "status": "optimal",
    "scope": "bundled-reference-date-directed-network",
    "referenceDate": "2026-10-13",
    "solver": {
      "name": "SciPy/HiGHS MILP + subtour elimination",
      "version": "1.13.1",
      "gap": 0
    },
    "constraints": {
      "repeatAirport": false,
      "fixedStart": null,
      "fixedEnd": null,
      "timetable": false
    }
  },
  {
    "id": "all-distance",
    "network": "ALL",
    "objective": "distance",
    "airportIds": [
      "jp-IZO",
      "jp-SDJ",
      "jp-HIJ",
      "jp-CTS",
      "jp-KMQ",
      "jp-OKA",
      "jp-IBR",
      "jp-FUK",
      "jp-HNA",
      "jp-NKM",
      "jp-AOJ",
      "jp-ITM",
      "jp-HKD",
      "jp-NGO",
      "jp-MMY",
      "jp-KIX",
      "jp-ISG",
      "jp-NRT",
      "jp-ASJ",
      "jp-RNJ",
      "jp-KOJ",
      "jp-FSZ",
      "jp-OKD",
      "jp-MMJ",
      "jp-UKB",
      "jp-SHI",
      "jp-HND",
      "jp-UEO"
    ],
    "routeIds": [
      "JP-IZO-SDJ",
      "JP-SDJ-HIJ",
      "JP-HIJ-CTS",
      "JP-CTS-KMQ",
      "JP-KMQ-OKA",
      "JP-OKA-IBR",
      "JP-IBR-FUK",
      "JP-FUK-HNA",
      "JP-HNA-NKM",
      "JP-NKM-AOJ",
      "JP-AOJ-ITM",
      "JP-ITM-HKD",
      "JP-HKD-NGO",
      "JP-NGO-MMY",
      "JP-MMY-KIX",
      "JP-KIX-ISG",
      "JP-ISG-NRT",
      "JP-NRT-ASJ",
      "JP-ASJ-RNJ",
      "JP-RNJ-KOJ",
      "JP-KOJ-FSZ",
      "JP-FSZ-OKD",
      "JP-OKD-MMJ",
      "JP-MMJ-UKB",
      "JP-UKB-SHI",
      "JP-SHI-HND",
      "JP-HND-UEO"
    ],
    "totalDistanceKm": 29036.084,
    "status": "optimal",
    "scope": "bundled-reference-date-directed-network",
    "referenceDate": "2026-10-13",
    "solver": {
      "name": "SciPy/HiGHS MILP + subtour elimination",
      "version": "1.13.1",
      "gap": 0
    },
    "constraints": {
      "repeatAirport": false,
      "fixedStart": null,
      "fixedEnd": null,
      "timetable": false
    }
  },
  {
    "id": "ana-legs",
    "network": "ANA",
    "objective": "legs",
    "airportIds": [
      "jp-RNJ",
      "jp-KOJ",
      "jp-TKN",
      "jp-OKE",
      "jp-OKA",
      "jp-HIJ",
      "jp-SDJ",
      "jp-CTS",
      "jp-KIX",
      "jp-ISG",
      "jp-MMY",
      "jp-NGO",
      "jp-NRT",
      "jp-ITM",
      "jp-AXT",
      "jp-HND",
      "jp-KMJ",
      "jp-AXJ",
      "jp-FUK",
      "jp-TSJ",
      "jp-NGS",
      "jp-FUJ"
    ],
    "routeIds": [
      "JP-RNJ-KOJ",
      "JP-KOJ-TKN",
      "JP-TKN-OKE",
      "JP-OKE-OKA",
      "JP-OKA-HIJ",
      "JP-HIJ-SDJ",
      "JP-SDJ-CTS",
      "JP-CTS-KIX",
      "JP-KIX-ISG",
      "JP-ISG-MMY",
      "JP-MMY-NGO",
      "JP-NGO-NRT",
      "JP-NRT-ITM",
      "JP-ITM-AXT",
      "JP-AXT-HND",
      "JP-HND-KMJ",
      "JP-KMJ-AXJ",
      "JP-AXJ-FUK",
      "JP-FUK-TSJ",
      "JP-TSJ-NGS",
      "JP-NGS-FUJ"
    ],
    "totalDistanceKm": 11390.738,
    "status": "optimal",
    "scope": "bundled-reference-date-directed-network",
    "referenceDate": "2026-10-13",
    "solver": {
      "name": "SciPy/HiGHS MILP + subtour elimination",
      "version": "1.13.1",
      "gap": 0
    },
    "constraints": {
      "repeatAirport": false,
      "fixedStart": null,
      "fixedEnd": null,
      "timetable": false
    }
  },
  {
    "id": "jal-legs",
    "network": "JAL",
    "objective": "legs",
    "airportIds": [
      "jp-IKI",
      "jp-NGS",
      "jp-TSJ",
      "jp-FUK",
      "jp-AXJ",
      "jp-KMJ",
      "jp-NGO",
      "jp-ISG",
      "jp-KIX",
      "jp-MMY",
      "jp-OKA",
      "jp-OKE",
      "jp-TKN",
      "jp-ASJ",
      "jp-KKX",
      "jp-KOJ",
      "jp-FSZ",
      "jp-OKD",
      "jp-OIR",
      "jp-HKD",
      "jp-ITM",
      "jp-SDJ",
      "jp-IZO",
      "jp-HND",
      "jp-AOJ",
      "jp-NKM",
      "jp-KIJ",
      "jp-CTS",
      "jp-MMJ",
      "jp-UKB"
    ],
    "routeIds": [
      "JP-IKI-NGS",
      "JP-NGS-TSJ",
      "JP-TSJ-FUK",
      "JP-FUK-AXJ",
      "JP-AXJ-KMJ",
      "JP-KMJ-NGO",
      "JP-NGO-ISG",
      "JP-ISG-KIX",
      "JP-KIX-MMY",
      "JP-MMY-OKA",
      "JP-OKA-OKE",
      "JP-OKE-TKN",
      "JP-TKN-ASJ",
      "JP-ASJ-KKX",
      "JP-KKX-KOJ",
      "JP-KOJ-FSZ",
      "JP-FSZ-OKD",
      "JP-OKD-OIR",
      "JP-OIR-HKD",
      "JP-HKD-ITM",
      "JP-ITM-SDJ",
      "JP-SDJ-IZO",
      "JP-IZO-HND",
      "JP-HND-AOJ",
      "JP-AOJ-NKM",
      "JP-NKM-KIJ",
      "JP-KIJ-CTS",
      "JP-CTS-MMJ",
      "JP-MMJ-UKB"
    ],
    "totalDistanceKm": 15153.891,
    "status": "optimal",
    "scope": "bundled-reference-date-directed-network",
    "referenceDate": "2026-10-13",
    "solver": {
      "name": "SciPy/HiGHS MILP + subtour elimination",
      "version": "1.13.1",
      "gap": 0
    },
    "constraints": {
      "repeatAirport": false,
      "fixedStart": null,
      "fixedEnd": null,
      "timetable": false
    }
  },
  {
    "id": "all-legs",
    "network": "ALL",
    "objective": "legs",
    "airportIds": [
      "jp-HTR",
      "jp-ISG",
      "jp-TRA",
      "jp-MMY",
      "jp-KIX",
      "jp-KMI",
      "jp-ITM",
      "jp-HNA",
      "jp-NKM",
      "jp-IZO",
      "jp-SDJ",
      "jp-HIJ",
      "jp-NRT",
      "jp-KCZ",
      "jp-NGO",
      "jp-AXT",
      "jp-CTS",
      "jp-IBR",
      "jp-UKB",
      "jp-NGS",
      "jp-FUJ",
      "jp-FUK",
      "jp-AXJ",
      "jp-KMJ",
      "jp-OKA",
      "jp-OKE",
      "jp-TKN",
      "jp-ASJ",
      "jp-RNJ",
      "jp-KOJ",
      "jp-FSZ",
      "jp-OKD",
      "jp-OIR",
      "jp-HKD",
      "jp-HND",
      "jp-HAC",
      "jp-MIKURAJIMA",
      "jp-MYE",
      "jp-OIM",
      "jp-CHOFU",
      "jp-KOZUSHIMA"
    ],
    "routeIds": [
      "JP-HTR-ISG",
      "JP-ISG-TRA",
      "JP-TRA-MMY",
      "JP-MMY-KIX",
      "JP-KIX-KMI",
      "JP-KMI-ITM",
      "JP-ITM-HNA",
      "JP-HNA-NKM",
      "JP-NKM-IZO",
      "JP-IZO-SDJ",
      "JP-SDJ-HIJ",
      "JP-HIJ-NRT",
      "JP-NRT-KCZ",
      "JP-KCZ-NGO",
      "JP-NGO-AXT",
      "JP-AXT-CTS",
      "JP-CTS-IBR",
      "JP-IBR-UKB",
      "JP-UKB-NGS",
      "JP-NGS-FUJ",
      "JP-FUJ-FUK",
      "JP-FUK-AXJ",
      "JP-AXJ-KMJ",
      "JP-KMJ-OKA",
      "JP-OKA-OKE",
      "JP-OKE-TKN",
      "JP-TKN-ASJ",
      "JP-ASJ-RNJ",
      "JP-RNJ-KOJ",
      "JP-KOJ-FSZ",
      "JP-FSZ-OKD",
      "JP-OKD-OIR",
      "JP-OIR-HKD",
      "JP-HKD-HND",
      "JP-HND-HAC",
      "JP-HAC-MIKURAJIMA",
      "JP-MIKURAJIMA-MYE",
      "JP-MYE-OIM",
      "JP-OIM-CHOFU",
      "JP-CHOFU-KOZUSHIMA"
    ],
    "totalDistanceKm": 16146.021,
    "status": "optimal",
    "scope": "bundled-reference-date-directed-network",
    "referenceDate": "2026-10-13",
    "solver": {
      "name": "SciPy/HiGHS MILP + subtour elimination",
      "version": "1.13.1",
      "gap": 0
    },
    "constraints": {
      "repeatAirport": false,
      "fixedStart": null,
      "fixedEnd": null,
      "timetable": false
    }
  }
]
